12:27:28.844508 IP 127.0.0.1.38598 > 127.0.0.1.8080: Flags [S], seq 3686440765, win 65495, options [mss 65495,sackOK,TS val 1319835283 ecr 0,nop,wscale 10], length 0
E..<
.@.@.1................=.........0.........
N..........

12:27:28.844534 IP 127.0.0.1.8080 > 127.0.0.1.38598: Flags [S.], seq 2228375971, ack 3686440766, win 65483, options [mss 65495,sackOK,TS val 3297634934 ecr 1319835283,nop,wscale 10], length 0
E..<..@.@.<...............Q....>.....0.........
...vN......

12:27:28.844554 IP 127.0.0.1.38598 > 127.0.0.1.8080: Flags [.], ack 1, win 64, options [nop,nop,TS val 1319835283 ecr 3297634934], length 0
E..4
.@.@.1................>..Q....@.(.....
N......v
12:27:28.845521 IP 127.0.0.1.38598 > 127.0.0.1.8080: Flags [P.], seq 1:176, ack 1, win 64, options [nop,nop,TS val 1319835284 ecr 3297634934], length 175: HTTP: POST /notes HTTP/1.1
E...
.@.@.13...............>..Q....@.......
N......vPOST /notes HTTP/1.1
Host: localhost:8080
User-Agent: curl/7.81.0
Accept: */*
Content-Type: application/json
Content-Length: 39

{"title":"trace me","body":"in flight"}
12:27:28.845577 IP 127.0.0.1.8080 > 127.0.0.1.38598: Flags [.], ack 176, win 64, options [nop,nop,TS val 3297634935 ecr 1319835284], length 0
E..4QO@.@..r..............Q........@.(.....
...wN...
12:27:28.857234 IP 127.0.0.1.8080 > 127.0.0.1.38598: Flags [P.], seq 1:207, ack 176, win 64, options [nop,nop,TS val 3297634947 ecr 1319835284], length 206: HTTP: HTTP/1.1 201 Created
E...QP@.@.................Q........@.......
....N...HTTP/1.1 201 Created
Content-Type: application/json
Date: Fri, 12 Jun 2026 09:27:28 GMT
Content-Length: 93

{"id":7,"title":"trace me","body":"in flight","created_at":"2026-06-12T09:27:28.846334414Z"}

12:27:28.857283 IP 127.0.0.1.38598 > 127.0.0.1.8080: Flags [.], ack 207, win 64, options [nop,nop,TS val 1319835296 ecr 3297634947], length 0
E..4
.@.@.1...................Rr...@.(.....
N.......
12:27:28.857618 IP 127.0.0.1.38598 > 127.0.0.1.8080: Flags [F.], seq 176, ack 207, win 64, options [nop,nop,TS val 1319835296 ecr 3297634947], length 0
E..4
.@.@.1...................Rr...@.(.....
N.......
12:27:28.857818 IP 127.0.0.1.8080 > 127.0.0.1.38598: Flags [F.], seq 207, ack 177, win 64, options [nop,nop,TS val 3297634947 ecr 1319835296], length 0
E..4QQ@.@..p..............Rr.......@.(.....
....N...
12:27:28.857845 IP 127.0.0.1.38598 > 127.0.0.1.8080: Flags [.], ack 208, win 64, options [nop,nop,TS val 1319835296 ecr 3297634947], length 0
E..4
.@.@.1...................Rs...@.(.....
N.......
